{
  "schemaVersion": 1,
  "generatedAt": "1970-01-01T00:00:00.000Z",
  "projectRoot": "/Users/paul/Repos/Arch4/arch4",
  "elements": [
    {
      "entityId": "aiAgent",
      "name": "AI Agent",
      "type": "person",
      "description": "Cursor agent that seeds and updates the architecture model from repository evidence.",
      "tags": [
        "Element",
        "Person"
      ],
      "paths": [
        ".cursor/commands/seed-arch4.md",
        ".cursor/commands/update-arch4.md",
        ".cursor/commands/review-arch4.md",
        ".cursor/skills/arch4/SKILL.md",
        ".cursor/skills/c4/SKILL.md",
        ".cursor/rules/arch4.mdc"
      ],
      "owners": [
        "Arch4"
      ],
      "confidence": "high",
      "openQuestions": [],
      "notes": {
        "summary": "Cursor agent invoked by Arch4: Create/Update Architecture Model to seed or maintain workspace.dsl and entity metadata from repository evidence."
      },
      "views": [
        "Arch4Containers",
        "Arch4SystemContext"
      ],
      "contributors": [],
      "recentCommits": [],
      "contextPath": ".arch4/architecture/build/context/aiAgent.md"
    },
    {
      "entityId": "arch4",
      "name": "Arch4",
      "type": "softwareSystem",
      "description": "Cursor plugin for generating, validating, indexing, and viewing enriched C4 architecture documentation.",
      "tags": [
        "Element",
        "Software System"
      ],
      "paths": [
        "README.md",
        "docs/architecture.md",
        "packages/**/*",
        "scripts/**/*"
      ],
      "owners": [
        "Arch4"
      ],
      "confidence": "high",
      "openQuestions": [
        "Internal npm packages are modeled as containers because this monorepo does not evidence separate deployable runtime services."
      ],
      "notes": {
        "summary": "Cursor plugin that keeps C4 architecture documentation next to code through Structurizr DSL source, enriched metadata, rendered views, and an interactive map.",
        "decisions": [
          "Model monorepo packages as C4 containers when no stronger runtime boundary is evidenced in repository manifests or deployment files."
        ]
      },
      "views": [
        "Arch4SystemContext"
      ],
      "contributors": [
        {
          "name": "Paul Stoeckle",
          "email": "mailo@paulstoeckle.com",
          "commits": 16
        }
      ],
      "recentCommits": [
        {
          "hash": "edf64fd50af53b83f61b1269c4857f534ebbfc40",
          "author": "Paul Stoeckle",
          "date": "2026-06-16",
          "subject": "Fix Arch4 create/update workspace workflow"
        },
        {
          "hash": "ea78be18127928264dd4d00a796d75501773dbe8",
          "author": "Paul Stoeckle",
          "date": "2026-06-15",
          "subject": "Fix extension overview media"
        },
        {
          "hash": "862b939f015faf5dd2a2efc4cb22aa078234a52d",
          "author": "Paul Stoeckle",
          "date": "2026-06-15",
          "subject": "Retry runtime downloads"
        },
        {
          "hash": "36ded428a9bd7317d2e814162cf7483c0123bf24",
          "author": "Paul Stoeckle",
          "date": "2026-06-15",
          "subject": "Update extension architecture map copy"
        },
        {
          "hash": "180315efa7192b4aa2afecfb9f9b2dd210112849",
          "author": "Paul Stoeckle",
          "date": "2026-06-15",
          "subject": "Fix marketplace README media"
        },
        {
          "hash": "8d77b674f85087842a7757f364b92b8901caf6f3",
          "author": "Paul Stoeckle",
          "date": "2026-06-15",
          "subject": "Refactor shared media assets"
        },
        {
          "hash": "b6cf17be9eb298368377de9f7344219b1f3c23b6",
          "author": "Paul Stoeckle",
          "date": "2026-06-15",
          "subject": "Update OpenVSX publish test"
        },
        {
          "hash": "a77509f7c49f9d8bb01ab943cfebbee9f5aeaae4",
          "author": "Paul Stoeckle",
          "date": "2026-06-15",
          "subject": "Fix OpenVSX VSIX publishing"
        },
        {
          "hash": "222a3aa1164846cfe4680c31f31efc2947ebb032",
          "author": "Paul Stoeckle",
          "date": "2026-06-15",
          "subject": "Use reinstall command in README quick start"
        },
        {
          "hash": "ff5c3469b3d35bb8734adc51f57a89056764b5dd",
          "author": "Paul Stoeckle",
          "date": "2026-06-15",
          "subject": "Clarify README quick start install"
        }
      ],
      "contextPath": ".arch4/architecture/build/context/arch4.md"
    },
    {
      "entityId": "arch4.arch4Cli",
      "name": "Arch4 CLI",
      "type": "container",
      "description": "Initializes, validates, renders, indexes, and serves architecture context for a repository.",
      "tags": [
        "Element",
        "Container"
      ],
      "paths": [
        "packages/cli/**/*"
      ],
      "owners": [
        "Arch4"
      ],
      "confidence": "high",
      "openQuestions": [],
      "notes": {
        "summary": "Node CLI that initializes Arch4 workspaces and runs validate, render, index, context, and doctor commands against repository-local architecture artifacts."
      },
      "views": [
        "Arch4Containers",
        "Arch4ExtensionComponents"
      ],
      "contributors": [
        {
          "name": "Paul Stoeckle",
          "email": "mailo@paulstoeckle.com",
          "commits": 2
        }
      ],
      "recentCommits": [
        {
          "hash": "edf64fd50af53b83f61b1269c4857f534ebbfc40",
          "author": "Paul Stoeckle",
          "date": "2026-06-16",
          "subject": "Fix Arch4 create/update workspace workflow"
        },
        {
          "hash": "1d74a893ccc5fcecd132aff66d1bae2c53bb16bd",
          "author": "Paul Stoeckle",
          "date": "2026-06-14",
          "subject": "Initial Arch4 release"
        }
      ],
      "contextPath": ".arch4/architecture/build/context/arch4.arch4Cli.md"
    },
    {
      "entityId": "arch4.arch4Cli.cliCommands",
      "name": "CLI Commands",
      "type": "component",
      "description": "Dispatches init, validate, render, index, context, and doctor commands.",
      "tags": [
        "Element",
        "Component"
      ],
      "paths": [
        "packages/cli/src/commands.ts",
        "packages/cli/src/index.ts",
        "packages/cli/src/args.ts"
      ],
      "owners": [
        "Arch4"
      ],
      "confidence": "high",
      "openQuestions": [],
      "notes": {
        "summary": "Command dispatcher for init, validate, render, index, context, and doctor workflows."
      },
      "views": [
        "Arch4CliComponents"
      ],
      "contributors": [
        {
          "name": "Paul Stoeckle",
          "email": "mailo@paulstoeckle.com",
          "commits": 2
        }
      ],
      "recentCommits": [
        {
          "hash": "edf64fd50af53b83f61b1269c4857f534ebbfc40",
          "author": "Paul Stoeckle",
          "date": "2026-06-16",
          "subject": "Fix Arch4 create/update workspace workflow"
        },
        {
          "hash": "1d74a893ccc5fcecd132aff66d1bae2c53bb16bd",
          "author": "Paul Stoeckle",
          "date": "2026-06-14",
          "subject": "Initial Arch4 release"
        }
      ],
      "contextPath": ".arch4/architecture/build/context/arch4.arch4Cli.cliCommands.md"
    },
    {
      "entityId": "arch4.arch4Cli.cliContext",
      "name": "Context Lookup",
      "type": "component",
      "description": "Maps changed files to architecture elements and renders compact context markdown.",
      "tags": [
        "Element",
        "Component"
      ],
      "paths": [
        "packages/cli/src/context.ts"
      ],
      "owners": [
        "Arch4"
      ],
      "confidence": "high",
      "openQuestions": [],
      "notes": {
        "summary": "Maps changed repository files to architecture elements and renders compact markdown context for agents and tooling."
      },
      "views": [
        "Arch4CliComponents"
      ],
      "contributors": [
        {
          "name": "Paul Stoeckle",
          "email": "mailo@paulstoeckle.com",
          "commits": 1
        }
      ],
      "recentCommits": [
        {
          "hash": "1d74a893ccc5fcecd132aff66d1bae2c53bb16bd",
          "author": "Paul Stoeckle",
          "date": "2026-06-14",
          "subject": "Initial Arch4 release"
        }
      ],
      "contextPath": ".arch4/architecture/build/context/arch4.arch4Cli.cliContext.md"
    },
    {
      "entityId": "arch4.arch4Cli.cliIndexer",
      "name": "Architecture Indexer",
      "type": "component",
      "description": "Builds architecture-index.json, context files, and git-enriched element metadata.",
      "tags": [
        "Element",
        "Component"
      ],
      "paths": [
        "packages/cli/src/indexer.ts",
        "packages/cli/src/repo-files.ts"
      ],
      "owners": [
        "Arch4"
      ],
      "confidence": "high",
      "openQuestions": [],
      "notes": {
        "summary": "Builds architecture-index.json, per-entity context markdown, and git-enriched contributor metadata from rendered views and entity paths."
      },
      "views": [
        "Arch4CliComponents"
      ],
      "contributors": [
        {
          "name": "Paul Stoeckle",
          "email": "mailo@paulstoeckle.com",
          "commits": 2
        }
      ],
      "recentCommits": [
        {
          "hash": "edf64fd50af53b83f61b1269c4857f534ebbfc40",
          "author": "Paul Stoeckle",
          "date": "2026-06-16",
          "subject": "Fix Arch4 create/update workspace workflow"
        },
        {
          "hash": "1d74a893ccc5fcecd132aff66d1bae2c53bb16bd",
          "author": "Paul Stoeckle",
          "date": "2026-06-14",
          "subject": "Initial Arch4 release"
        }
      ],
      "contextPath": ".arch4/architecture/build/context/arch4.arch4Cli.cliIndexer.md"
    },
    {